{
  "schema_id": "reviewer",
  "reviewer": "genomics-reviewer",
  "status": "complete",
  "overall_assessment": "BLOCK",
  "summary": "Variant normalization absent before annotation — duplicate protein entries guaranteed downstream. No hard filters applied to raw callset. Combined with proteogenomics deduplication failure, this represents a cascade failure through the entire pipeline.",
  "findings": [
    {
      "id": "GEN-1",
      "severity": "CRITICAL",
      "category": "variant-calling",
      "file": "pipeline/variant_calling.nf",
      "line": 103,
      "end_line": 112,
      "title": "Variant normalization absent before VEP annotation",
      "message": "No bcftools norm or vt normalize step between HaplotypeCaller output and VEP annotation. Without left-alignment and parsimony normalisation, the same indel can be represented in multiple non-canonical forms across samples. VEP annotation lookup may fail for non-canonical representations, and identical variants from different samples will not be recognised as equivalent in the proteogenomics database, generating duplicate protein entries for what is biologically the same substitution.",
      "impact": "Duplicate protein entries inflate the search database. Multiple representations of the same indel will each generate a distinct protein sequence, multiplying the search space proportionally to the degree of non-normalisation. Downstream FDR is degraded for every duplicated variant protein. Functional annotation may be incorrect for non-left-aligned indels.",
      "recommendation": "Insert 'bcftools norm -f {params.ref} -m -both' immediately after genotyping and before VEP annotation. Verify with: bcftools stats before_norm.vcf.gz vs after_norm.vcf.gz — normalisation should reduce total variant count by 5-15% for typical WGS cohorts.",
      "code_snippet": "process GENOTYPEGVCFS {\n    // ...\n    gatk GenotypeGVCFs -R ${params.ref} -V ${gvcf} -O ${sample}.vcf.gz\n}\n\n// MISSING: BCFTOOLS_NORM process\n\nprocess VEP_ANNOTATE {\n    input: path vcf  // receives unnormalized vcf directly\n}",
      "sharp_edge_id": "genomics-vc-no-normalization",
      "references": ["https://genome.sph.umich.edu/wiki/Variant_Normalization"]
    },
    {
      "id": "GEN-2",
      "severity": "WARNING",
      "category": "variant-calling",
      "file": "pipeline/variant_calling.nf",
      "line": 118,
      "end_line": 122,
      "title": "No hard filters or VQSR applied to raw variant callset",
      "message": "HaplotypeCaller output is passed directly to downstream annotation without any VariantFiltration or VQSR step. Cohort size (n=12) is below the recommended minimum for VQSR (n=30 for WGS). Hard filters per GATK best practices should be applied instead.",
      "impact": "Raw HaplotypeCaller callsets carry 10-30% false positive rate. Unfiltered false positive variants propagate to VEP annotation and the proteogenomics custom database, generating peptide candidates that will never be observed by mass spectrometry.",
      "recommendation": "Apply GATK hard filters: QD < 2.0, FS > 60.0, MQ < 40.0 for SNPs; QD < 2.0, FS > 200.0, ReadPosRankSum < -20.0 for indels. Apply GENOTYPE_FILTER for GQ < 20.",
      "code_snippet": "// GenotypeGVCFs -> VEP with no filtering step",
      "sharp_edge_id": "genomics-vc-no-filter",
      "references": []
    },
    {
      "id": "GEN-3",
      "severity": "WARNING",
      "category": "alignment",
      "file": "pipeline/alignment.nf",
      "line": 45,
      "end_line": 52,
      "title": "Duplicate marking absent from alignment pipeline",
      "message": "No Picard MarkDuplicates or samtools markdup between BWA-MEM2 alignment and BQSR. PCR duplicates inflate allele depths, distorting the heterozygous/homozygous ratio in the variant callset.",
      "impact": "Allele depth inflated for amplified fragments. In combination with missing hard filters (GEN-2), false confident variant calls from duplicate-inflated allele depths will pass to downstream DB construction.",
      "recommendation": "Add Picard MarkDuplicates after BWA-MEM2 sort. For patterned flow cells (NovaSeq), set OPTICAL_DUPLICATE_PIXEL_DISTANCE=2500.",
      "code_snippet": "// bwa-mem2 | samtools sort -> directly to ApplyBQSR\n// MISSING: MarkDuplicates",
      "sharp_edge_id": "genomics-align-no-dedup",
      "references": []
    }
  ],
  "files_reviewed": 4,
  "files_skipped": 0,
  "metadata": {
    "duration_ms": 44100,
    "thinking_budget_used": 8300,
    "attempt_number": 1
  }
}
